<!--
        	
        Copyright  1990-2007 Sun Microsystems, Inc. All Rights Reserved.
        DO NOT ALTER OR REMOVE COPYRIGHT NOTICES OR THIS FILE HEADER
        
        This program is free software; you can redistribute it and/or
        modify it under the terms of the GNU General Public License version
        2 only, as published by the Free Software Foundation.
        
        This program is distributed in the hope that it will be useful, but
        WITHOUT ANY WARRANTY; without even the implied warranty of
        MERCHANTABILITY or FITNESS FOR A PARTICULAR PURPOSE. See the GNU
        General Public License version 2 for more details (a copy is
        included at /legal/license.txt).
        
        You should have received a copy of the GNU General Public License
        version 2 along with this work; if not, write to the Free Software
        Foundation, Inc., 51 Franklin St, Fifth Floor, Boston, MA
        02110-1301 USA
        
        Please contact Sun Microsystems, Inc., 4150 Network Circle, Santa
        Clara, CA 95054 or visit www.sun.com if you need additional
        information or have any questions.
-->
<!ELEMENT configuration (properties | constants)+>
<!ELEMENT properties (property)+>
<!ELEMENT property EMPTY>
<!-- If callout is specified, it must be a defined native function -->
<!--  with the signature: char* foo(void) -->
<!ATTLIST property
        Key      CDATA                          #REQUIRED
        Value    CDATA                          #REQUIRED
        Scope    (system | internal)            "internal"
        Callout  CDATA                          #IMPLIED
        Comment  CDATA                          #IMPLIED
>
<!ELEMENT constants (constant_class)+>
<!ELEMENT constant_class (constant)+>
<!ATTLIST constant_class
    Package  CDATA                          #REQUIRED
    Name     CDATA                          #REQUIRED
    Scope    (protected | public)           "public"
    Comment  CDATA                          #IMPLIED
>

<!ELEMENT constant EMPTY>
<!ATTLIST constant
    Type     (int | String | boolean)       #IMPLIED
    Name     CDATA                          #REQUIRED
    Value    CDATA                          #REQUIRED
    VScope   (protected | public | private) #REQUIRED
    Comment  CDATA                          #IMPLIED
>
