<?xml version="1.0" encoding="UTF-8"?>
<!DOCTYPE configuration SYSTEM "configuration.dtd">
<!--
    
  
  Copyright  1990-2007 Sun Microsystems, Inc. All Rights Reserved.
  DO NOT ALTER OR REMOVE COPYRIGHT NOTICES OR THIS FILE HEADER
  
  This program is free software; you can redistribute it and/or
  modify it under the terms of the GNU General Public License version
  2 only, as published by the Free Software Foundation.
  
  This program is distributed in the hope that it will be useful, but
  WITHOUT ANY WARRANTY; without even the implied warranty of
  MERCHANTABILITY or FITNESS FOR A PARTICULAR PURPOSE. See the GNU
  General Public License version 2 for more details (a copy is
  included at /legal/license.txt).
  
  You should have received a copy of the GNU General Public License
  version 2 along with this work; if not, write to the Free Software
  Foundation, Inc., 51 Franklin St, Fifth Floor, Boston, MA
  02110-1301 USA
  
  Please contact Sun Microsystems, Inc., 4150 Network Circle, Santa
  Clara, CA 95054 or visit www.sun.com if you need additional
  information or have any questions.
  
-->
<!-- System-independent JSR 205 properties required by the specification -->
<configuration>
  <properties>
    <!-- SYSTEM PROPERTIES -->
    <!-- Visible from System.getProperty() -->

    <property Key="wireless.messaging.version"
      Value="1.1"
      Scope="system"
      Comment="WMA version number."/>

    <property Key="wireless.messaging.sms.smsc"
      Value="+17815511212"
      Scope="system"
      Comment="Default SMS Service Center address."/>
    
    <!-- INTERNAL PROPERTIES -->
    <!-- Visible from Configuration.getProperty() -->
    <property Key="com.sun.midp.io.j2me.wma.DatagramHost"
      Value="wmadatagramhost"
      Comment="The datagram host name for wma emulated messages."/>
    
    <property Key="com.sun.midp.io.j2me.sms.DatagramPortIn"
      Value="11100"
      Scope="internal"
      Comment="The datagram port number for inbound SMS messages."/>
    
    <property Key="com.sun.midp.io.j2me.sms.DatagramPortOut"
      Value="11101"
      Scope="internal"
      Comment="The datagram port number of outbound SMS messages."/>
    
    <property Key="com.sun.midp.io.j2me.cbs.DatagramPortIn"
      Value="22200"
      Scope="internal"
      Comment="The datagram port number for inbound CBS messages."/>
    
    <property Key="com.sun.midp.io.j2me.sms.PhoneNumber"
      Value="+5551212"
      Scope="internal"
      Comment="The phone number for outbound messages from the SMS emulator."/>
    
  </properties>
</configuration>
